{
  "$schema": "http://json-schema.org/draft-07/schema#",
  "title": "PromptMatrix Framework Schema",
  "description": "Schema for validating PromptMatrix 2.0 framework definitions.",
  "type": "object",
  "definitions": {
    "FrameworkComponent": {
      "type": "object",
      "required": [
        "name",
        "label",
        "type"
      ],
      "properties": {
        "name": {
          "type": "string"
        },
        "label": {
          "type": "string"
        },
        "type": {
          "type": "string",
          "enum": [
            "text",
            "number",
            "select",
            "textarea",
            "color",
            "date",
            "slider",
            "boolean",
            "code",
            "multiselect",
            "image",
            "file"
          ]
        },
        "placeholder": {
          "type": "string"
        },
        "options": {
          "type": "array",
          "items": {
            "oneOf": [
              {
                "type": "string"
              },
              {
                "type": "object",
                "required": [
                  "label",
                  "value"
                ],
                "properties": {
                  "label": {
                    "type": "string"
                  },
                  "value": {
                    "type": "string"
                  }
                }
              }
            ]
          }
        },
        "info": {
          "type": "string"
        },
        "min": {
          "type": "number"
        },
        "max": {
          "type": "number"
        },
        "step": {
          "type": "number"
        },
        "optional": {
          "type": "boolean"
        },
        "unit": {
          "type": "string"
        },
        "validation": {
          "type": "object",
          "properties": {
            "min_length": {
              "type": "number"
            },
            "max_length": {
              "type": "number"
            },
            "regex": {
              "type": "string"
            },
            "min_value": {
              "type": "number"
            },
            "max_value": {
              "type": "number"
            },
            "min_date": {
              "type": "string",
              "format": "date-time"
            },
            "max_date": {
              "type": "string",
              "format": "date-time"
            }
          },
          "additionalProperties": false
        }
      }
    },
    "DynamicSubcomponents": {
      "type": "object",
      "required": [
        "trigger",
        "options"
      ],
      "properties": {
        "trigger": {
          "type": "string"
        },
        "options": {
          "type": "object",
          "patternProperties": {
            "^[a-zA-Z0-9_\\s&/()\\-.]+$": {
              "oneOf": [
                {
                  "description": "Legacy structure: Direct array of components.",
                  "type": "array",
                  "items": {
                    "$ref": "#/definitions/FrameworkComponent"
                  }
                },
                {
                  "description": "New Super-Framework structure: Object containing components and optional prompt overrides.",
                  "type": "object",
                  "required": [
                    "components"
                  ],
                  "properties": {
                    "components": {
                      "type": "array",
                      "items": {
                        "$ref": "#/definitions/FrameworkComponent"
                      }
                    },
                    "komponen_prompt": {
                      "type": "object",
                      "properties": {
                        "PERAN": {
                          "type": "string"
                        },
                        "KONTEKS": {
                          "type": "string"
                        },
                        "TUGAS": {
                          "type": "string"
                        },
                        "FORMAT_OUTPUT": {
                          "type": "string"
                        },
                        "FORMAT OUTPUT": {
                          "type": "string"
                        }
                      },
                      "additionalProperties": true
                    }
                  },
                  "additionalProperties": true
                }
              ]
            }
          },
          "additionalProperties": false
        }
      }
    }
  },
  "required": [
    "description",
    "toolType",
    "examples",
    "temperature",
    "top_p",
    "top_k",
    "version",
    "updated_at"
  ],
  "properties": {
    "temperature": {
      "type": "number",
      "minimum": 0,
      "maximum": 1,
      "description": "Optional: Controls the randomness of the output. Higher values mean more random output. (0-1)"
    },
    "top_p": {
      "type": "number",
      "minimum": 0,
      "maximum": 1,
      "description": "Optional: The maximum cumulative probability of tokens to consider for sampling. (0-1)"
    },
    "top_k": {
      "type": "number",
      "minimum": 1,
      "description": "Optional: The maximum number of tokens to consider for sampling. (>=1)"
    },
    "examples": {
      "type": "array",
      "description": "Optional: Few-shot examples to guide the AI's behavior.",
      "items": {
        "type": "object",
        "required": [
          "input",
          "output"
        ],
        "properties": {
          "input": {
            "type": "string",
            "description": "Example input for the AI."
          },
          "output": {
            "type": "string",
            "description": "Expected output from the AI for the given input."
          }
        },
        "additionalProperties": false
      }
    },
    "id_kerangka": {
      "type": "string",
      "pattern": "^[A-Z]{2,4}-[A-Z]{2,4}-\\d{3}$",
      "description": "Unique identifier for the framework (e.g., 'PE-001-001')."
    },
    "nama_kerangka": {
      "type": "string",
      "description": "Name of the framework."
    },
    "version": {
      "type": "string",
      "pattern": "^\\d+\\.\\d+\\.\\d+$",
      "description": "Version of the framework (e.g., '1.0.0')."
    },
    "updated_at": {
      "type": "string",
      "pattern": "^\\d{4}-\\d{2}-\\d{2}T\\d{2}:\\d{2}:\\d{2}(\\.\\d+)?(Z)?$",
      "description": "Last update timestamp for the framework metadata."
    },
    "kategori": {
      "type": "array",
      "items": {
        "type": "string"
      },
      "minItems": 2,
      "maxItems": 2,
      "description": "Main category and sub-category."
    },
    "perspektif_user": {
      "type": "string",
      "description": "Description from the user's perspective."
    },
    "ai_logic_description": {
      "type": "string",
      "description": "AI persona and logic description."
    },
    "komponen_prompt": {
      "type": "object",
      "required": [
        "PERAN",
        "KONTEKS",
        "TUGAS"
      ],
      "properties": {
        "PERAN": {
          "type": "string"
        },
        "KONTEKS": {
          "type": "string"
        },
        "TUGAS": {
          "type": "string"
        },
        "FORMAT_OUTPUT": {
          "type": "string"
        },
        "FORMAT OUTPUT": {
          "type": "string"
        }
      },
      "additionalProperties": true
    },
    "konteks_tambahan_instruksi_khusus": {
      "type": "string",
      "description": "Additional context or special instructions."
    },
    "contoh_kalimat": {
      "type": "string",
      "description": "Example sentence for user request."
    },
    "output": {
      "type": "string",
      "enum": [
        "natural_language_prompt",
        "json_prompt"
      ],
      "description": "Type of output expected."
    },
    "description": {
      "type": "string",
      "description": "Description of the framework."
    },
    "toolType": {
      "type": "string",
      "enum": [
        "text",
        "code",
        "music-composition",
        "music-generation",
        "audio-generation",
        "image-generation",
        "image-editing",
        "planning",
        "video"
      ],
      "description": "Type of tool the framework is for."
    },
    "components": {
      "type": "array",
      "description": "Optional: Array of framework components (input fields).",
      "items": {
        "$ref": "#/definitions/FrameworkComponent"
      }
    },
    "dynamicSubcomponents": {
      "description": "Optional: Dynamic subcomponents triggered by other inputs.",
      "oneOf": [
        {
          "$ref": "#/definitions/DynamicSubcomponents"
        },
        {
          "type": "array",
          "items": {
            "$ref": "#/definitions/DynamicSubcomponents"
          }
        }
      ]
    }
  }
}
