{
  "description": "Buat teks iklan pendek dan persuasif untuk platform seperti Google Ads atau Facebook Ads.",
  "toolType": "text",
  "ai_logic_description": "Persona AI: Anda adalah seorang Spesialis Iklan Digital yang akan membuat teks iklan.",
  "components": [
    {
      "name": "platform",
      "label": "Platform Iklan",
      "type": "select",
      "options": [
        "Google Ads",
        "Facebook/Instagram Ads",
        "LinkedIn Ads",
        "Twitter Ads",
        "Lainnya..."
      ],
      "info": "Setiap platform memiliki batasan karakter dan format yang berbeda.",
      "optional": true
    },
    {
      "name": "product",
      "label": "Produk/Jasa yang Diiklankan",
      "type": "text",
      "placeholder": "e.g., 'Software CRM untuk UKM'",
      "info": "Apa yang Anda promosikan?",
      "validation": {
        "min_length": 5
      },
      "optional": true
    },
    {
      "name": "targetAudience",
      "label": "Target Audiens Iklan",
      "type": "text",
      "placeholder": "e.g., 'Pemilik usaha kecil, manajer penjualan'",
      "info": "Siapa yang ingin Anda jangkau dengan iklan ini?",
      "validation": {
        "min_length": 5
      },
      "optional": true
    },
    {
      "name": "uniqueBenefit",
      "label": "Manfaat Unik & Utama",
      "type": "text",
      "placeholder": "e.g., 'Hemat waktu 10 jam per minggu'",
      "info": "Apa satu manfaat paling kuat yang akan menarik perhatian?",
      "validation": {
        "min_length": 10
      },
      "optional": true
    },
    {
      "name": "callToAction",
      "label": "Call to Action (CTA)",
      "type": "text",
      "placeholder": "e.g., 'Coba Gratis Sekarang', 'Unduh Laporannya'",
      "info": "Perintah yang jelas dan spesifik untuk pengguna.",
      "validation": {
        "min_length": 5
      },
      "optional": true
    },
    {
      "name": "additionalContext",
      "label": "Konteks Tambahan & Instruksi Khusus",
      "type": "textarea",
      "placeholder": "Contoh: Buat 3 variasi headline. Gunakan nada yang mendesak. Tonjolkan penawaran diskon 20%.",
      "info": "Instruksi spesifik tentang jumlah variasi, nada, atau penawaran.",
      "optional": true,
      "validation": {
        "min_length": 10
      }
    },
    {
      "name": "custom_platform",
      "label": "Sebutkan Platform Iklan Lainnya",
      "type": "text",
      "description": "Input kustom untuk Platform Iklan.",
      "placeholder": "Ketik opsi kustom...",
      "optional": false,
      "validation": {
        "min_length": 2
      },
      "info": "Manual input jika opsi standar tidak tersedia."
    }
  ],
  "kategori": [
    "Teks & Konten",
    "Pemasaran & Penjualan"
  ],
  "nama_kerangka": "Penulis Teks Iklan (Ad Copy)",
  "examples": [],
  "temperature": 0.7,
  "top_p": 0.9,
  "top_k": 40,
  "version": "2.0.0",
  "updated_at": "2025-12-23T06:59:23.996112",
  "komponen_prompt": {
    "PERAN": "Persona AI: Anda adalah seorang Spesialis Iklan Digital yang akan membuat teks iklan.. [Platform Iklan: **{platform}**]",
    "KONTEKS": "Saya ingin create konten marketing untuk {platform} dengan format {product}. [Konteks Tambahan & Instruksi Khusus: {additionalContext}].",
    "TUGAS": "Develop marketing content atau strategy yang engaging dan sesuai dengan target audience.",
    "FORMAT_OUTPUT": "Sajikan dalam format marketing-ready dengan clear call-to-action dan measurable objectives."
  }
}