{
  "description": "Perbaiki tulisan yang ada agar lebih jelas, ringkas, kuat, dan berdampak.",
  "toolType": "text",
  "ai_logic_description": "Persona AI: Anda adalah seorang Editor Gaya Bahasa yang akan menganalisis dan menyempurnakan tulisan.",
  "components": [
    {
      "name": "originalText",
      "label": "Teks Asli",
      "type": "textarea",
      "placeholder": "Tempelkan paragraf atau tulisan yang ingin disempurnakan di sini.",
      "info": "AI akan menganalisis dan memberikan saran perbaikan, bukan menulis ulang total.",
      "validation": {
        "min_length": 20
      }
    },
    {
      "name": "improvementGoal",
      "label": "Fokus Penyempurnaan",
      "type": "select",
      "options": [
        "Meningkatkan Kejelasan & Keringkasan",
        "Membuat Lebih Persuasif",
        "Menguatkan Gaya Bahasa",
        "Memeriksa Alur & Logika",
        "Lainnya..."
      ],
      "info": "Pilih aspek utama yang ingin Anda perbaiki dari tulisan ini."
    },
    {
      "name": "targetAudience",
      "label": "Target Pembaca",
      "type": "text",
      "placeholder": "e.g., 'Tim internal, klien potensial, pembaca umum'",
      "info": "Mengetahui audiens membantu AI memberikan saran yang lebih relevan.",
      "validation": {
        "min_length": 5
      }
    },
    {
      "name": "additionalContext",
      "label": "Konteks Tambahan & Instruksi Khusus",
      "type": "textarea",
      "placeholder": "Contoh: Pertahankan nada yang ramah. Ganti semua kalimat pasif menjadi aktif. Tawarkan alternatif untuk kata-kata yang terlalu sering digunakan.",
      "info": "Instruksi spesifik tentang jenis perbaikan yang Anda cari.",
      "optional": true,
      "validation": {
        "min_length": 10
      }
    }
  ],
  "kategori": [
    "Teks & Konten",
    "Alat Bantu Menulis"
  ],
  "nama_kerangka": "Pemeriksa & Penyempurna Gaya Bahasa",
  "examples": [],
  "temperature": 0.7,
  "top_p": 0.9,
  "top_k": 40,
  "version": "2.0.0",
  "updated_at": "2025-12-23T06:16:58.624115",
  "komponen_prompt": {
    "PERAN": "Persona AI: Anda adalah seorang Editor Gaya Bahasa yang akan menganalisis dan menyempurnakan tulisan.. [Fokus Penyempurnaan: **{{improvementGoal}}**]",
    "KONTEKS": "Saya ingin create konten tertulis tentang {{originalText}} untuk {{improvementGoal}}. [Konteks Tambahan & Instruksi Khusus: {{additionalContext}}].",
    "TUGAS": "Generate konten tertulis yang engaging, informatif, dan sesuai dengan tujuan yang diminta.",
    "FORMAT_OUTPUT": "Sajikan dalam format yang sesuai dengan medium target (blog, email, social media, etc.) dengan struktur yang jelas."
  },
  "dynamicSubcomponents": [
    {
      "trigger": "improvementGoal",
      "options": {
        "Lainnya...": [
          {
            "name": "custom_improvementGoal",
            "label": "Sebutkan Fokus Penyempurnaan Lainnya",
            "type": "text",
            "description": "Input kustom untuk Fokus Penyempurnaan.",
            "placeholder": "Ketik opsi kustom...",
            "optional": false,
            "validation": {
              "min_length": 2
            },
            "info": "Manual input jika opsi standar tidak tersedia."
          }
        ]
      }
    }
  ]
}