{
  "description": "Dapatkan serangkaian pertanyaan atau prompt yang merangsang pemikiran untuk jurnal harian Anda.",
  "toolType": "text",
  "ai_logic_description": "Persona AI: Anda adalah seorang Fasilitator Jurnal yang akan menghasilkan serangkaian pertanyaan atau prompt untuk jurnal.",
  "components": [
    {
      "name": "journalTheme",
      "label": "Tema Jurnal Hari Ini",
      "type": "select",
      "options": [
        "Rasa Syukur (Gratitude)",
        "Refleksi Harian",
        "Penetapan Tujuan",
        "Mengatasi Stres/Kecemasan",
        "Meningkatkan Kreativitas",
        "Lainnya..."
      ],
      "info": "Pilih fokus untuk sesi jurnal Anda."
    },
    {
      "name": "currentMood",
      "label": "Perasaan Anda Saat Ini (Opsional)",
      "type": "text",
      "placeholder": "e.g., 'Merasa lelah', 'Bersemangat', 'Sedikit cemas'",
      "info": "Membantu AI menyesuaikan pertanyaan agar lebih relevan dengan kondisi Anda."
    },
    {
      "name": "numberOfPrompts",
      "label": "Jumlah Prompt/Pertanyaan",
      "type": "number",
      "placeholder": "e.g., 5",
      "info": "Berapa banyak pertanyaan panduan yang Anda inginkan?"
    },
    {
      "name": "promptStyle",
      "label": "Gaya Prompt",
      "type": "select",
      "options": [
        "Pertanyaan Reflektif Mendalam",
        "Latihan Singkat & Praktis",
        "Prompt Kreatif & Imajinatif",
        "Lainnya..."
      ],
      "info": "Pilih jenis pertanyaan yang paling Anda butuhkan saat ini."
    },
    {
      "name": "additionalContext",
      "label": "Konteks Tambahan & Instruksi Khusus",
      "type": "textarea",
      "placeholder": "Contoh: Fokus pada pencapaian kecil. Hindari pertanyaan tentang pekerjaan. Buat pertanyaan yang bisa dijawab dalam 1-2 kalimat.",
      "info": "Preferensi personal untuk memandu AI."
    }
  ],
  "kategori": [
    "Teks & Konten",
    "Pengembangan Diri & Psikologi"
  ],
  "nama_kerangka": "Alat Bantu Jurnal Terpandu",
  "examples": [],
  "temperature": 0.7,
  "top_p": 0.9,
  "top_k": 40,
  "version": "2.0.0",
  "updated_at": "2025-12-23T06:59:24.030843",
  "komponen_prompt": {
    "PERAN": "Persona AI: Anda adalah seorang Fasilitator Jurnal yang akan menghasilkan serangkaian pertanyaan atau prompt untuk jurnal.. [Tema Jurnal Hari Ini: **{journalTheme}**] [Gaya Prompt: **{promptStyle}**]",
    "KONTEKS": "Saya ingin create konten tertulis tentang {journalTheme} untuk {currentMood}. [Konteks Tambahan & Instruksi Khusus: {additionalContext}].",
    "TUGAS": "Generate code atau technical guidance yang clean, efficient, dan mengikuti best practices.",
    "FORMAT_OUTPUT": "Sajikan dengan code examples, explanations, dan best practice recommendations yang jelas."
  },
  "dynamicSubcomponents": [
    {
      "trigger": "journalTheme",
      "options": {
        "Lainnya...": [
          {
            "name": "custom_journalTheme",
            "label": "Sebutkan Tema Jurnal Hari Ini Lainnya",
            "type": "text",
            "description": "Input kustom untuk Tema Jurnal Hari Ini.",
            "placeholder": "Ketik opsi kustom...",
            "optional": false,
            "validation": {
              "min_length": 2
            },
            "info": "Manual input jika opsi standar tidak tersedia."
          }
        ]
      }
    },
    {
      "trigger": "promptStyle",
      "options": {
        "Lainnya...": [
          {
            "name": "custom_promptStyle",
            "label": "Sebutkan Gaya Prompt Lainnya",
            "type": "text",
            "description": "Input kustom untuk Gaya Prompt.",
            "placeholder": "Ketik opsi kustom...",
            "optional": false,
            "validation": {
              "min_length": 2
            },
            "info": "Manual input jika opsi standar tidak tersedia."
          }
        ]
      }
    }
  ]
}