{
  "description": "Rangkum dokumen hukum yang panjang (misal: Ketentuan Layanan) ke dalam bahasa yang mudah dipahami.",
  "toolType": "text",
  "ai_logic_description": "Persona AI: Anda adalah seorang Analis Hukum yang akan menganalisis dokumen hukum dan mengekstrak poin-poin penting.",
  "components": [
    {
      "name": "legalDocument",
      "label": "Teks Dokumen Legal",
      "type": "textarea",
      "placeholder": "Tempelkan seluruh teks dari dokumen legal seperti Ketentuan Layanan atau Kebijakan Privasi di sini.",
      "info": "AI akan menganalisis teks ini untuk menemukan poin-poin terpentipenting.",
      "validation": {
        "min_length": 50
      },
      "optional": true
    },
    {
      "name": "myRole",
      "label": "Peran Saya",
      "type": "select",
      "options": [
        "Sebagai Konsumen/Pengguna",
        "Sebagai Pemilik Bisnis",
        "Lainnya..."
      ],
      "info": "Dari sudut pandang mana AI harus menganalisis dokumen ini?",
      "optional": true
    },
    {
      "name": "focus",
      "label": "Fokus Analisis",
      "type": "text",
      "placeholder": "e.g., 'Kewajiban saya', 'Hak saya atas data', 'Klausul pembatalan'",
      "info": "Aspek apa dari dokumen yang paling ingin Anda pahami?",
      "optional": true
    },
    {
      "name": "outputFormat",
      "label": "FORMAT_OUTPUT",
      "type": "select",
      "options": [
        "Poin-poin Ringkasan",
        "Tanya Jawab (FAQ)",
        "Tabel Hak & Kewajiban",
        "Lainnya..."
      ],
      "info": "Pilih cara penyajian ringkasan yang paling mudah Anda pahami.",
      "optional": true
    },
    {
      "name": "additionalContext",
      "label": "Konteks Tambahan & Instruksi Khusus",
      "type": "textarea",
      "placeholder": "Contoh: Cari 'red flags' atau klausa yang tidak biasa. Terjemahkan jargon hukum ke bahasa sehari-hari. Abaikan bagian definisi.",
      "info": "Instruksi spesifik tentang apa yang harus dicari atau diabaikan oleh AI.",
      "validation": {
        "min_length": 10
      },
      "optional": true
    },
    {
      "name": "custom_myRole",
      "label": "Sebutkan Peran Saya Lainnya",
      "type": "text",
      "description": "Input kustom untuk Peran Saya.",
      "placeholder": "Ketik opsi kustom...",
      "optional": false,
      "validation": {
        "min_length": 2
      },
      "info": "Manual input jika opsi standar tidak tersedia."
    },
    {
      "name": "custom_outputFormat",
      "label": "Sebutkan FORMAT_OUTPUT Lainnya",
      "type": "text",
      "description": "Input kustom untuk FORMAT_OUTPUT.",
      "placeholder": "Ketik opsi kustom...",
      "optional": false,
      "validation": {
        "min_length": 2
      },
      "info": "Manual input jika opsi standar tidak tersedia."
    }
  ],
  "kategori": [
    "Teks & Konten",
    "Utilitas & Development"
  ],
  "nama_kerangka": "Analis & Perangkum Dokumen Legal",
  "examples": [],
  "temperature": 0.7,
  "top_p": 0.9,
  "top_k": 40,
  "version": "2.0.0",
  "updated_at": "2025-12-23T06:59:24.266115",
  "komponen_prompt": {
    "PERAN": "Persona AI: Anda adalah seorang Analis Hukum yang akan menganalisis dokumen hukum dan mengekstrak poin-poin penting.. [Peran Saya: **{myRole}**] [FORMAT_OUTPUT: **{outputFormat}**]",
    "KONTEKS": "Saya ingin create konten tertulis tentang {legalDocument} untuk {myRole}. [Konteks Tambahan & Instruksi Khusus: {additionalContext}].",
    "TUGAS": "Generate konten tertulis yang engaging, informatif, dan sesuai dengan tujuan yang diminta.",
    "FORMAT_OUTPUT": "Sajikan dalam format yang sesuai dengan medium target (blog, email, social media, etc.) dengan struktur yang jelas."
  }
}