{
  "description": "Bangun sebuah adegan untuk cerita atau skenario dengan mendeskripsikan lingkungan, karakter, dan dialog.",
  "toolType": "text",
  "ai_logic_description": "Persona AI: Anda adalah seorang Perancang Adegan yang akan membangun sebuah adegan yang detail untuk cerita atau skenario.",
  "components": [
    {
      "name": "setting",
      "label": "Latar (Setting)",
      "type": "textarea",
      "placeholder": "e.g., 'Sebuah kafe remang-remang di Paris saat hujan. Bau kopi dan roti panggang terasa di udara.'",
      "info": "Deskripsikan tempat, waktu, dan suasana adegan."
    },
    {
      "name": "characters",
      "label": "Karakter dalam Adegan",
      "type": "textarea",
      "placeholder": "e.g., 'ELARA (30-an), seorang seniman yang cemas, memegang cangkir teh. JAVIER (40-an), tenang dan misterius, membaca buku.'",
      "info": "Siapa saja yang ada di adegan itu dan apa yang mereka lakukan?"
    },
    {
      "name": "plotPoint",
      "label": "Poin Plot atau Tujuan Adegan",
      "type": "textarea",
      "placeholder": "e.g., 'Elara harus memberanikan diri untuk berbicara dengan Javier dan menanyakan tentang simbol misterius yang terus muncul dalam mimpinya.'",
      "info": "Apa tujuan atau peristiwa penting yang harus terjadi dalam adegan ini?"
    },
    {
      "name": "dialoguePrompt",
      "label": "Pemicu Dialog",
      "type": "textarea",
      "placeholder": "e.g., 'Mulai dengan Elara yang menjatuhkan sendoknya, menarik perhatian Javier.'",
      "info": "Bagaimana percakapan atau interaksi dimulai?"
    },
    {
      "name": "additionalContext",
      "label": "Konteks Tambahan & Instruksi Khusus",
      "type": "textarea",
      "placeholder": "Contoh: Berikan batasan atau instruksi spesifik untuk memandu AI.",
      "info": "Sebutkan batasan, gaya penulisan spesifik, atau informasi latar yang penting untuk dipahami AI."
    }
  ],
  "kategori": [
    "Prompt Ringkas",
    "Persona, Gaya & Skenario"
  ],
  "nama_kerangka": "SceneCraft",
  "examples": [],
  "temperature": 0.7,
  "top_p": 0.9,
  "top_k": 40,
  "version": "2.0.0",
  "updated_at": "2025-12-23T06:59:23.317699",
  "komponen_prompt": {
    "PERAN": "Persona AI: Anda adalah seorang Perancang Adegan yang akan membangun sebuah adegan yang detail untuk cerita atau skenario.",
    "KONTEKS": "Input yang saya berikan: {setting}, {characters}, {plotPoint}. [Konteks Tambahan & Instruksi Khusus: {additionalContext}].",
    "TUGAS": "Generate output yang sesuai dengan tujuan 'SceneCraft' berdasarkan input yang diberikan.",
    "FORMAT_OUTPUT": "Sajikan output dalam format yang terstruktur, jelas, dan mudah dipahami."
  }
}